"cluster_id","topic","intent","primary_keyword","secondary_keywords","target_page_type","priority","notes"
"industry_w1_wix_seller_financing","wix seller funding","commercial_investigation","wix seller financing","wix funding,wix business financing,ecommerce seller cash flow funding,online store working capital","industry_pages","p1","Wave 1 batch_01 industry cluster for Wix sellers. Align with /industries/wix-seller-financing."
"industry_w1_ecommerce_business_funding","ecommerce business funding","commercial_investigation","ecommerce business funding","ecommerce business financing,online business funding,ecommerce working capital,ecommerce cash flow funding","industry_pages","p1","Wave 1 batch_01 industry cluster for ecommerce operators. Align with /industries/ecommerce-business-funding."
"industry_w1_restaurant_funding","restaurant funding","commercial_investigation","restaurant funding","restaurant business funding,restaurant working capital,restaurant cash flow financing,food service funding","industry_pages","p1","Wave 1 batch_01 industry cluster for restaurant operators. Align with /industries/restaurant-funding."
"industry_w1_trucking_business_funding","trucking business funding","commercial_investigation","trucking business funding","trucking business funding,transportation business financing,fleet working capital,owner operator funding","industry_pages","p1","Wave 1 batch_01 industry cluster for trucking operators. Align with /industries/trucking-funding."
"industry_w1_contractor_business_funding","contractor business funding","commercial_investigation","contractor business funding","contractor business funding,construction business financing,contractor working capital,construction cash flow funding","industry_pages","p1","Wave 1 batch_01 industry cluster for contractors. Align with /industries/construction-contractor-funding."
